Protein target,Organism,Biological system,Desired modulation,Corresponding assay,Metric used,Rationale,Crystallized structure available?,UniProt accession number,Chembl
CDK20,Human,Hepatocellular carcinoma (cell-cycle regulation),Direct inhibition,Biochemical kinase binding assay,Kd / IC₅₀,Strong multi-omics association with HCC; oncogenic role via CDK2 activation; kinase druggability with limited prior structural/chemical data,No,Q8IZL9,CHEMBL3559690
CDK2,Human,Pan-cancer cell-cycle control,Direct inhibition,Enzymatic kinase activity assay,IC₅₀,Well-validated CDK with strong cancer relevance; included as a reference comparator,Yes,P24941,CHEMBL301
PLK1,Human,Mitotic regulation in cancer,Direct inhibition,Enzymatic kinase assay,IC₅₀,High expression in proliferative tumors; classic mitotic kinase target,Yes,P53350,CHEMBL3024
AURKA,Human,Mitotic spindle assembly,Direct inhibition,Cell-based proliferation assay,GI₅₀ / IC₅₀,Strong cancer driver with abundant literature; used to anchor target ranking,Yes,O14965,CHEMBL4722
TTK,Human,Spindle checkpoint signaling,Direct inhibition,Enzymatic kinase assay,IC₅₀,Oncology relevance with partial structural coverage; moderate novelty,Partial,P33981,CHEMBL3983
